{
  "key": "switch",
  "name": "Switch",
  "description": "Props for the Switch component.",
  "kind": "single",
  "parts": [
    {
      "id": "switch",
      "name": "Switch",
      "access": {
        "kind": "export",
        "name": "Switch"
      },
      "description": "Props for the Switch component.",
      "generics": [
        {
          "name": "TTrue",
          "default": "boolean"
        },
        {
          "name": "TFalse",
          "default": "boolean"
        }
      ],
      "defaultElement": "div",
      "props": [
        {
          "name": "checked",
          "optional": true,
          "type": "TTrue | TFalse",
          "description": "Whether the switch is checked."
        },
        {
          "name": "checkedIcon",
          "optional": true,
          "type": "IconT.Name",
          "description": "Icon shown when the switch is checked."
        },
        {
          "name": "class",
          "optional": true,
          "type": "SlotClassValue",
          "description": "Class applied to the component root or trigger element."
        },
        {
          "name": "classes",
          "optional": true,
          "type": "Classes",
          "description": "Family slot class defaults for this instance."
        },
        {
          "name": "defaultChecked",
          "optional": true,
          "type": "boolean",
          "description": "Whether the switch is checked by default."
        },
        {
          "name": "description",
          "optional": true,
          "type": "JSX.Element",
          "description": "Description for the switch."
        },
        {
          "name": "disabled",
          "optional": true,
          "type": "boolean",
          "description": "Whether the input is disabled.",
          "default": {
            "kind": "literal",
            "value": false
          }
        },
        {
          "name": "falseValue",
          "optional": true,
          "type": "TFalse",
          "description": "Value to use when the switch is unchecked.",
          "default": {
            "kind": "literal",
            "value": false
          }
        },
        {
          "name": "id",
          "optional": true,
          "type": "string",
          "description": "The ID of the input element."
        },
        {
          "name": "inputRef",
          "optional": true,
          "type": "Ref<HTMLInputElement>",
          "description": "Optional inner input element ref."
        },
        {
          "name": "label",
          "optional": true,
          "type": "JSX.Element",
          "description": "Label for the switch."
        },
        {
          "name": "loading",
          "optional": true,
          "type": "boolean",
          "description": "Whether the switch is in a loading state.",
          "default": {
            "kind": "literal",
            "value": false
          }
        },
        {
          "name": "loadingIcon",
          "optional": true,
          "type": "IconT.Name",
          "description": "Icon shown during loading state.",
          "default": {
            "kind": "literal",
            "value": "icon-loading"
          }
        },
        {
          "name": "name",
          "optional": true,
          "type": "string",
          "description": "The name of the input element, used for form submission."
        },
        {
          "name": "onCheckedChange",
          "optional": true,
          "type": "(value: TTrue | TFalse) => void",
          "description": "Callback when the switch state changes."
        },
        {
          "name": "onPointerDown",
          "optional": true,
          "type": "JSX.EventHandlerUnion<HTMLButtonElement, PointerEvent>",
          "description": "Pointer down handler for the switch root container."
        },
        {
          "name": "readOnly",
          "optional": true,
          "type": "boolean",
          "description": "Whether the input is read-only.",
          "default": {
            "kind": "literal",
            "value": false
          }
        },
        {
          "name": "required",
          "optional": true,
          "type": "boolean",
          "description": "Whether the input is required.",
          "default": {
            "kind": "literal",
            "value": false
          }
        },
        {
          "name": "size",
          "optional": true,
          "type": "'sm' | 'md' | 'lg'",
          "description": "Visual size of the component.",
          "default": {
            "kind": "literal",
            "value": "md"
          }
        },
        {
          "name": "style",
          "optional": true,
          "type": "SlotStyleValue",
          "description": "Style applied to the component root or trigger element."
        },
        {
          "name": "styles",
          "optional": true,
          "type": "Styles",
          "description": "Family slot style defaults for this instance."
        },
        {
          "name": "trueValue",
          "optional": true,
          "type": "TTrue",
          "description": "Value to use when the switch is checked.",
          "default": {
            "kind": "literal",
            "value": true
          }
        },
        {
          "name": "uncheckedIcon",
          "optional": true,
          "type": "IconT.Name",
          "description": "Icon shown when the switch is unchecked."
        },
        {
          "name": "value",
          "optional": true,
          "type": "string",
          "description": "Native value submitted when the switch is checked.",
          "default": {
            "kind": "literal",
            "value": "on"
          }
        }
      ]
    }
  ],
  "slots": [
    "root",
    "track",
    "thumb",
    "icon",
    "wrapper",
    "label",
    "description"
  ],
  "dataAttributes": [
    {
      "target": "root",
      "attributes": [
        "data-checked",
        "data-disabled",
        "data-invalid",
        "data-loading",
        "data-readonly",
        "data-required",
        "data-unchecked"
      ]
    },
    {
      "target": "track",
      "attributes": [
        "data-checked",
        "data-disabled",
        "data-invalid",
        "data-readonly",
        "data-unchecked"
      ]
    },
    {
      "target": "thumb",
      "attributes": [
        "data-checked",
        "data-disabled",
        "data-unchecked"
      ]
    },
    {
      "target": "icon",
      "attributes": [
        "data-checked",
        "data-loading",
        "data-unchecked"
      ]
    },
    {
      "target": "label",
      "attributes": [
        "data-required"
      ]
    }
  ]
}
