{
  "$schema": "https://moraine.subf.dev/component-api.schema.json",
  "key": "badge",
  "name": "Badge",
  "description": "Props for the Badge component.",
  "kind": "single",
  "parts": [
    {
      "id": "badge",
      "name": "Badge",
      "access": {
        "kind": "export",
        "name": "Badge"
      },
      "description": "Props for the Badge component.",
      "generics": [
        {
          "name": "T",
          "constraint": "ValidComponent",
          "default": "'span'"
        }
      ],
      "defaultElement": "span",
      "props": [
        {
          "name": "as",
          "optional": true,
          "type": "T",
          "description": "Root element or component.",
          "default": {
            "kind": "literal",
            "value": "span"
          }
        },
        {
          "name": "children",
          "optional": true,
          "type": "JSX.Element",
          "description": "Children of the badge."
        },
        {
          "name": "class",
          "optional": true,
          "type": "SlotClassValue",
          "description": "Class applied to the component root or trigger element."
        },
        {
          "name": "classes",
          "optional": true,
          "type": "Classes",
          "description": "Family slot class defaults for this instance."
        },
        {
          "name": "leading",
          "optional": true,
          "type": "IconT.Name",
          "description": "Leading icon name."
        },
        {
          "name": "size",
          "optional": true,
          "type": "'sm' | 'md' | 'lg'",
          "description": "Visual size of the component.",
          "default": {
            "kind": "literal",
            "value": "md"
          }
        },
        {
          "name": "style",
          "optional": true,
          "type": "SlotStyleValue",
          "description": "Style applied to the component root or trigger element."
        },
        {
          "name": "styles",
          "optional": true,
          "type": "Styles",
          "description": "Family slot style defaults for this instance."
        },
        {
          "name": "title",
          "optional": true,
          "type": "string",
          "description": "Accessible title shown by the browser for the badge root."
        },
        {
          "name": "trailing",
          "optional": true,
          "type": "IconT.Name",
          "description": "Trailing icon name."
        },
        {
          "name": "variant",
          "optional": true,
          "type": "'solid' | 'subtle' | 'surface' | 'outline'",
          "description": "Visual treatment of the component.",
          "default": {
            "kind": "literal",
            "value": "subtle"
          }
        }
      ]
    }
  ],
  "slots": [
    "root",
    "leading",
    "label",
    "trailing"
  ],
  "dataAttributes": []
}
