{
  "$schema": "https://moraine.subf.dev/component-api.schema.json",
  "key": "input-group",
  "name": "InputGroup",
  "kind": "composite",
  "parts": [
    {
      "id": "input-group",
      "name": "InputGroup",
      "access": {
        "kind": "export",
        "name": "InputGroup"
      },
      "defaultElement": "div",
      "props": [
        {
          "name": "class",
          "optional": true,
          "type": "SlotClassValue",
          "description": "Class applied to the component root or trigger element."
        },
        {
          "name": "classes",
          "optional": true,
          "type": "Classes",
          "description": "Family slot class defaults for this instance."
        },
        {
          "name": "orientation",
          "optional": true,
          "type": "'horizontal' | 'vertical'",
          "description": "Axis shared by the group and its supporting parts.",
          "default": {
            "kind": "literal",
            "value": "horizontal"
          }
        },
        {
          "name": "size",
          "optional": true,
          "type": "'sm' | 'md' | 'lg'",
          "description": "Visual size of the component.",
          "default": {
            "kind": "literal",
            "value": "md"
          }
        },
        {
          "name": "style",
          "optional": true,
          "type": "SlotStyleValue",
          "description": "Style applied to the component root or trigger element."
        },
        {
          "name": "styles",
          "optional": true,
          "type": "Styles",
          "description": "Family slot style defaults for this instance."
        },
        {
          "name": "variant",
          "optional": true,
          "type": "'outline' | 'subtle' | 'ghost' | 'none'",
          "description": "Visual treatment of the component.",
          "default": {
            "kind": "literal",
            "value": "outline"
          }
        }
      ]
    },
    {
      "id": "input-group-leading",
      "name": "InputGroup.Leading",
      "access": {
        "kind": "attached",
        "root": "InputGroup",
        "member": "Leading"
      },
      "defaultElement": "div",
      "props": [
        {
          "name": "children",
          "optional": true,
          "type": "JSX.Element",
          "description": "Icons, text, buttons, or other caller-owned content."
        },
        {
          "name": "class",
          "optional": true,
          "type": "SlotClassValue",
          "description": "Class applied to the component root or trigger element."
        },
        {
          "name": "compact",
          "optional": true,
          "type": "boolean",
          "description": "Removes the padding between this part and the adjacent control.",
          "default": {
            "kind": "literal",
            "value": false
          }
        },
        {
          "name": "style",
          "optional": true,
          "type": "SlotStyleValue",
          "description": "Style applied to the component root or trigger element."
        }
      ]
    },
    {
      "id": "input-group-trailing",
      "name": "InputGroup.Trailing",
      "access": {
        "kind": "attached",
        "root": "InputGroup",
        "member": "Trailing"
      },
      "defaultElement": "div",
      "props": [
        {
          "name": "children",
          "optional": true,
          "type": "JSX.Element",
          "description": "Icons, text, buttons, or other caller-owned content."
        },
        {
          "name": "class",
          "optional": true,
          "type": "SlotClassValue",
          "description": "Class applied to the component root or trigger element."
        },
        {
          "name": "compact",
          "optional": true,
          "type": "boolean",
          "description": "Removes the padding between this part and the adjacent control.",
          "default": {
            "kind": "literal",
            "value": false
          }
        },
        {
          "name": "style",
          "optional": true,
          "type": "SlotStyleValue",
          "description": "Style applied to the component root or trigger element."
        }
      ]
    }
  ],
  "slots": [
    "root",
    "leading",
    "trailing",
    "frame"
  ],
  "dataAttributes": [
    {
      "target": "root",
      "attributes": [
        "data-input-group",
        "data-orientation"
      ]
    },
    {
      "target": "leading",
      "attributes": [
        "data-compact",
        "data-orientation"
      ]
    },
    {
      "target": "trailing",
      "attributes": [
        "data-compact",
        "data-orientation"
      ]
    }
  ]
}
