{
  "$schema": "https://moraine.subf.dev/component-api.schema.json",
  "key": "list",
  "name": "List",
  "kind": "single",
  "parts": [
    {
      "id": "list",
      "name": "List",
      "access": {
        "kind": "export",
        "name": "List"
      },
      "generics": [
        {
          "name": "TItem"
        },
        {
          "name": "T",
          "constraint": "ValidComponent",
          "default": "'ul'"
        }
      ],
      "defaultElement": "ul",
      "props": [
        {
          "name": "as",
          "optional": true,
          "type": "T",
          "description": "Root element or component.",
          "default": {
            "kind": "literal",
            "value": "ul"
          }
        },
        {
          "name": "class",
          "optional": true,
          "type": "SlotClassValue",
          "description": "Class applied to the component root or trigger element."
        },
        {
          "name": "classes",
          "optional": true,
          "type": "Classes",
          "description": "Family slot class defaults for this instance."
        },
        {
          "name": "fallback",
          "optional": true,
          "type": "JSX.Element",
          "description": "Content rendered inside the list when the collection is empty."
        },
        {
          "name": "itemRender",
          "optional": false,
          "type": "Component<ItemRenderProps<TItem>>",
          "description": "Renders one collection item."
        },
        {
          "name": "items",
          "optional": true,
          "type": "readonly TItem[]",
          "description": "Reactive collection rendered by the list."
        },
        {
          "name": "style",
          "optional": true,
          "type": "SlotStyleValue",
          "description": "Style applied to the component root or trigger element."
        },
        {
          "name": "styles",
          "optional": true,
          "type": "Styles",
          "description": "Family slot style defaults for this instance."
        },
        {
          "name": "virtualizer",
          "optional": true,
          "type": "Virtualizer<TItem>",
          "description": "Renders only the visible items. The list root is the scroll container."
        }
      ]
    }
  ],
  "slots": [
    "root"
  ],
  "dataAttributes": []
}
