{
  "$schema": "https://moraine.subf.dev/component-api.schema.json",
  "key": "card",
  "name": "Card",
  "description": "Props for Card.",
  "kind": "composite",
  "parts": [
    {
      "id": "card",
      "name": "Card",
      "access": {
        "kind": "export",
        "name": "Card"
      },
      "description": "Props for Card.",
      "generics": [
        {
          "name": "T",
          "constraint": "ValidComponent",
          "default": "'div'"
        }
      ],
      "defaultElement": "div",
      "props": [
        {
          "name": "as",
          "optional": true,
          "type": "T",
          "description": "Element or component to render as.",
          "default": {
            "kind": "literal",
            "value": "div"
          }
        },
        {
          "name": "children",
          "optional": true,
          "type": "JSX.Element",
          "description": "Card parts and direct content."
        },
        {
          "name": "class",
          "optional": true,
          "type": "SlotClassValue",
          "description": "Class applied to the component root or trigger element."
        },
        {
          "name": "classes",
          "optional": true,
          "type": "Classes",
          "description": "Family slot class defaults for this instance."
        },
        {
          "name": "size",
          "optional": true,
          "type": "'sm' | 'md' | 'lg'",
          "description": "Density of all Card parts.",
          "default": {
            "kind": "literal",
            "value": "md"
          }
        },
        {
          "name": "style",
          "optional": true,
          "type": "SlotStyleValue",
          "description": "Style applied to the component root or trigger element."
        },
        {
          "name": "styles",
          "optional": true,
          "type": "Styles",
          "description": "Family slot style defaults for this instance."
        },
        {
          "name": "variant",
          "optional": true,
          "type": "'outline' | 'subtle' | 'none'",
          "description": "Footer border and background. The outer border is always present.",
          "default": {
            "kind": "literal",
            "value": "outline"
          }
        }
      ]
    },
    {
      "id": "card-header",
      "name": "Card.Header",
      "access": {
        "kind": "attached",
        "root": "Card",
        "member": "Header"
      },
      "generics": [
        {
          "name": "T",
          "constraint": "ValidComponent",
          "default": "'div'"
        }
      ],
      "defaultElement": "div",
      "props": [
        {
          "name": "as",
          "optional": true,
          "type": "T",
          "default": {
            "kind": "literal",
            "value": "div"
          }
        },
        {
          "name": "children",
          "optional": true,
          "type": "JSX.Element"
        },
        {
          "name": "class",
          "optional": true,
          "type": "SlotClassValue",
          "description": "Class applied to the component root or trigger element."
        },
        {
          "name": "style",
          "optional": true,
          "type": "SlotStyleValue",
          "description": "Style applied to the component root or trigger element."
        }
      ]
    },
    {
      "id": "card-title",
      "name": "Card.Title",
      "access": {
        "kind": "attached",
        "root": "Card",
        "member": "Title"
      },
      "generics": [
        {
          "name": "T",
          "constraint": "ValidComponent",
          "default": "'div'"
        }
      ],
      "defaultElement": "div",
      "props": [
        {
          "name": "as",
          "optional": true,
          "type": "T",
          "default": {
            "kind": "literal",
            "value": "div"
          }
        },
        {
          "name": "children",
          "optional": true,
          "type": "JSX.Element"
        },
        {
          "name": "class",
          "optional": true,
          "type": "SlotClassValue",
          "description": "Class applied to the component root or trigger element."
        },
        {
          "name": "style",
          "optional": true,
          "type": "SlotStyleValue",
          "description": "Style applied to the component root or trigger element."
        }
      ]
    },
    {
      "id": "card-description",
      "name": "Card.Description",
      "access": {
        "kind": "attached",
        "root": "Card",
        "member": "Description"
      },
      "generics": [
        {
          "name": "T",
          "constraint": "ValidComponent",
          "default": "'p'"
        }
      ],
      "defaultElement": "p",
      "props": [
        {
          "name": "as",
          "optional": true,
          "type": "T",
          "default": {
            "kind": "literal",
            "value": "p"
          }
        },
        {
          "name": "children",
          "optional": true,
          "type": "JSX.Element"
        },
        {
          "name": "class",
          "optional": true,
          "type": "SlotClassValue",
          "description": "Class applied to the component root or trigger element."
        },
        {
          "name": "style",
          "optional": true,
          "type": "SlotStyleValue",
          "description": "Style applied to the component root or trigger element."
        }
      ]
    },
    {
      "id": "card-action",
      "name": "Card.Action",
      "access": {
        "kind": "attached",
        "root": "Card",
        "member": "Action"
      },
      "generics": [
        {
          "name": "T",
          "constraint": "ValidComponent",
          "default": "'div'"
        }
      ],
      "defaultElement": "div",
      "props": [
        {
          "name": "as",
          "optional": true,
          "type": "T",
          "default": {
            "kind": "literal",
            "value": "div"
          }
        },
        {
          "name": "children",
          "optional": true,
          "type": "JSX.Element"
        },
        {
          "name": "class",
          "optional": true,
          "type": "SlotClassValue",
          "description": "Class applied to the component root or trigger element."
        },
        {
          "name": "style",
          "optional": true,
          "type": "SlotStyleValue",
          "description": "Style applied to the component root or trigger element."
        }
      ]
    },
    {
      "id": "card-body",
      "name": "Card.Body",
      "access": {
        "kind": "attached",
        "root": "Card",
        "member": "Body"
      },
      "generics": [
        {
          "name": "T",
          "constraint": "ValidComponent",
          "default": "'div'"
        }
      ],
      "defaultElement": "div",
      "props": [
        {
          "name": "as",
          "optional": true,
          "type": "T",
          "default": {
            "kind": "literal",
            "value": "div"
          }
        },
        {
          "name": "children",
          "optional": true,
          "type": "JSX.Element"
        },
        {
          "name": "class",
          "optional": true,
          "type": "SlotClassValue",
          "description": "Class applied to the component root or trigger element."
        },
        {
          "name": "style",
          "optional": true,
          "type": "SlotStyleValue",
          "description": "Style applied to the component root or trigger element."
        }
      ]
    },
    {
      "id": "card-footer",
      "name": "Card.Footer",
      "access": {
        "kind": "attached",
        "root": "Card",
        "member": "Footer"
      },
      "generics": [
        {
          "name": "T",
          "constraint": "ValidComponent",
          "default": "'div'"
        }
      ],
      "defaultElement": "div",
      "props": [
        {
          "name": "as",
          "optional": true,
          "type": "T",
          "default": {
            "kind": "literal",
            "value": "div"
          }
        },
        {
          "name": "children",
          "optional": true,
          "type": "JSX.Element"
        },
        {
          "name": "class",
          "optional": true,
          "type": "SlotClassValue",
          "description": "Class applied to the component root or trigger element."
        },
        {
          "name": "style",
          "optional": true,
          "type": "SlotStyleValue",
          "description": "Style applied to the component root or trigger element."
        }
      ]
    }
  ],
  "slots": [
    "root",
    "header",
    "title",
    "description",
    "action",
    "body",
    "footer"
  ],
  "dataAttributes": []
}
