{
  "$schema": "https://moraine.subf.dev/component-api.schema.json",
  "key": "field",
  "name": "Field",
  "description": "Props for the Field component.",
  "kind": "single",
  "parts": [
    {
      "id": "field",
      "name": "Field",
      "access": {
        "kind": "export",
        "name": "Field"
      },
      "description": "Props for the Field component.",
      "generics": [
        {
          "name": "T",
          "constraint": "ValidComponent",
          "default": "'div'"
        }
      ],
      "defaultElement": "div",
      "props": [
        {
          "name": "as",
          "optional": true,
          "type": "T",
          "description": "The HTML element or component to render as.",
          "default": {
            "kind": "literal",
            "value": "div"
          }
        },
        {
          "name": "children",
          "optional": true,
          "type": "JSX.Element | Component<RenderProps>",
          "description": "Content or render function receiving the field state.\nA render function must declare its parameter, even when unused. A zero-argument\nfunction is called as an accessor and is not mounted as a component."
        },
        {
          "name": "class",
          "optional": true,
          "type": "SlotClassValue",
          "description": "Class applied to the component root or trigger element."
        },
        {
          "name": "classes",
          "optional": true,
          "type": "Classes",
          "description": "Family slot class defaults for this instance."
        },
        {
          "name": "description",
          "optional": true,
          "type": "JSX.Element",
          "description": "Description text shown below the label."
        },
        {
          "name": "disabled",
          "optional": true,
          "type": "boolean",
          "description": "Whether controls inherit a disabled state."
        },
        {
          "name": "error",
          "optional": true,
          "type": "JSX.Element",
          "description": "Custom error message or force error state."
        },
        {
          "name": "help",
          "optional": true,
          "type": "JSX.Element",
          "description": "Help text shown below the control when no error is present."
        },
        {
          "name": "hiddenLabel",
          "optional": true,
          "type": "string",
          "description": "Visually hidden label used when no non-empty visible label is provided."
        },
        {
          "name": "hint",
          "optional": true,
          "type": "JSX.Element",
          "description": "Hint text shown near the label."
        },
        {
          "name": "id",
          "optional": true,
          "type": "string",
          "description": "Unique identifier for the field."
        },
        {
          "name": "label",
          "optional": true,
          "type": "JSX.Element",
          "description": "Label for the field."
        },
        {
          "name": "name",
          "optional": true,
          "type": "Name",
          "description": "Optional standalone field name."
        },
        {
          "name": "orientation",
          "optional": true,
          "type": "'vertical' | 'horizontal'",
          "description": "Visual layout direction.",
          "default": {
            "kind": "literal",
            "value": "vertical"
          }
        },
        {
          "name": "readOnly",
          "optional": true,
          "type": "boolean",
          "description": "Whether controls inherit a read-only state."
        },
        {
          "name": "required",
          "optional": true,
          "type": "boolean",
          "description": "Whether the field is required.",
          "default": {
            "kind": "literal",
            "value": false
          }
        },
        {
          "name": "size",
          "optional": true,
          "type": "'sm' | 'md' | 'lg'",
          "description": "Visual size of the component.",
          "default": {
            "kind": "literal",
            "value": "md"
          }
        },
        {
          "name": "style",
          "optional": true,
          "type": "SlotStyleValue",
          "description": "Style applied to the component root or trigger element."
        },
        {
          "name": "styles",
          "optional": true,
          "type": "Styles",
          "description": "Family slot style defaults for this instance."
        }
      ]
    }
  ],
  "slots": [
    "root",
    "wrapper",
    "labelWrapper",
    "label",
    "container",
    "description",
    "error",
    "hint",
    "help"
  ],
  "dataAttributes": [
    {
      "target": "label",
      "attributes": [
        "data-required"
      ]
    },
    {
      "target": "container",
      "attributes": [
        "data-has-text"
      ]
    }
  ]
}
