{
  "$schema": "https://moraine.subf.dev/component-api.schema.json",
  "key": "accordion",
  "name": "Accordion",
  "description": "Props for the Accordion component.",
  "kind": "single",
  "parts": [
    {
      "id": "accordion",
      "name": "Accordion",
      "access": {
        "kind": "export",
        "name": "Accordion"
      },
      "description": "Props for the Accordion component.",
      "defaultElement": "div",
      "props": [
        {
          "name": "class",
          "optional": true,
          "type": "SlotClassValue",
          "description": "Class applied to the component root or trigger element."
        },
        {
          "name": "classes",
          "optional": true,
          "type": "Classes",
          "description": "Family slot class defaults for this instance."
        },
        {
          "name": "collapsible",
          "optional": true,
          "type": "boolean",
          "description": "Whether the last expanded item can be collapsed.",
          "default": {
            "kind": "literal",
            "value": true
          }
        },
        {
          "name": "defaultValue",
          "optional": true,
          "type": "string[]",
          "description": "Default list of expanded item values for uncontrolled usage.",
          "default": {
            "kind": "expression",
            "text": "[]"
          }
        },
        {
          "name": "disabled",
          "optional": true,
          "type": "boolean",
          "description": "Whether the entire accordion is disabled.",
          "default": {
            "kind": "literal",
            "value": false
          }
        },
        {
          "name": "id",
          "optional": true,
          "type": "string",
          "description": "Unique identifier for the accordion root element."
        },
        {
          "name": "items",
          "optional": true,
          "type": "Item[]",
          "typeDetails": "({\n  /** Header label for the accordion item. */\n  label?: JSX.Element;\n  /** Accessible label for the accordion trigger button.\nUseful when `label` is omitted, icon-only, or contains non-text content. */\n  ariaLabel?: string;\n  /** Unique value for the accordion item. */\n  value?: string;\n  /** Whether the accordion item is disabled. */\n  disabled?: boolean;\n  /** Leading icon name for the accordion item. */\n  leading?: IconT.Name;\n  /** Content to display when the accordion item is expanded. */\n  content?: JSX.Element;\n  /** Optional class applied to the item element. */\n  class?: SlotClassValue;\n})[]",
          "description": "Array of accordion items to render."
        },
        {
          "name": "loop",
          "optional": true,
          "type": "boolean",
          "description": "Whether arrow-key focus wraps from the last trigger to the first and vice versa.",
          "default": {
            "kind": "literal",
            "value": true
          }
        },
        {
          "name": "multiple",
          "optional": true,
          "type": "boolean",
          "description": "Whether multiple accordion items can be expanded at the same time.",
          "default": {
            "kind": "literal",
            "value": false
          }
        },
        {
          "name": "onChange",
          "optional": true,
          "type": "(value: string[]) => void",
          "description": "Callback when the expanded item values change."
        },
        {
          "name": "style",
          "optional": true,
          "type": "SlotStyleValue",
          "description": "Style applied to the component root or trigger element."
        },
        {
          "name": "styles",
          "optional": true,
          "type": "Styles",
          "description": "Family slot style defaults for this instance."
        },
        {
          "name": "trailing",
          "optional": true,
          "type": "IconT.Name",
          "description": "Trailing icon name for all accordion items.",
          "default": {
            "kind": "literal",
            "value": "icon-chevron-down"
          }
        },
        {
          "name": "unmountOnHide",
          "optional": true,
          "type": "boolean",
          "description": "Whether to unmount accordion content when hidden.",
          "default": {
            "kind": "literal",
            "value": true
          }
        },
        {
          "name": "value",
          "optional": true,
          "type": "string[]",
          "description": "Controlled list of expanded item values."
        }
      ]
    }
  ],
  "item": {
    "props": [
      {
        "name": "ariaLabel",
        "optional": true,
        "type": "string",
        "description": "Accessible label for the accordion trigger button.\nUseful when `label` is omitted, icon-only, or contains non-text content."
      },
      {
        "name": "class",
        "optional": true,
        "type": "SlotClassValue",
        "description": "Optional class applied to the item element."
      },
      {
        "name": "content",
        "optional": true,
        "type": "JSX.Element",
        "description": "Content to display when the accordion item is expanded."
      },
      {
        "name": "disabled",
        "optional": true,
        "type": "boolean",
        "description": "Whether the accordion item is disabled.",
        "default": {
          "kind": "literal",
          "value": false
        }
      },
      {
        "name": "label",
        "optional": true,
        "type": "JSX.Element",
        "description": "Header label for the accordion item."
      },
      {
        "name": "leading",
        "optional": true,
        "type": "IconT.Name",
        "description": "Leading icon name for the accordion item."
      },
      {
        "name": "value",
        "optional": true,
        "type": "string",
        "description": "Unique value for the accordion item."
      }
    ]
  },
  "slots": [
    "root",
    "item",
    "header",
    "trigger",
    "leading",
    "label",
    "trailing",
    "content",
    "body"
  ],
  "dataAttributes": [
    {
      "target": "root",
      "attributes": [
        "data-disabled"
      ]
    },
    {
      "target": "item",
      "attributes": [
        "data-closed",
        "data-disabled",
        "data-expanded"
      ]
    },
    {
      "target": "trigger",
      "attributes": [
        "data-closed",
        "data-disabled",
        "data-expanded"
      ]
    },
    {
      "target": "trailing",
      "attributes": [
        "data-expanded"
      ]
    },
    {
      "target": "content",
      "attributes": [
        "data-closed",
        "data-expanded"
      ]
    }
  ]
}
