{
  "$schema": "https://moraine.subf.dev/component-api.schema.json",
  "key": "avatar",
  "name": "Avatar",
  "description": "Props for the Avatar component.",
  "kind": "single",
  "parts": [
    {
      "id": "avatar",
      "name": "Avatar",
      "access": {
        "kind": "export",
        "name": "Avatar"
      },
      "description": "Props for the Avatar component.",
      "defaultElement": "span",
      "props": [
        {
          "name": "alt",
          "optional": true,
          "type": "string",
          "description": "Accessible alt text for the avatar."
        },
        {
          "name": "badge",
          "optional": true,
          "type": "IconT.Name",
          "description": "Icon name for the badge."
        },
        {
          "name": "badgePosition",
          "optional": true,
          "type": "'top-left' | 'top-right' | 'bottom-left' | 'bottom-right'",
          "description": "Position of the badge relative to the avatar.",
          "default": {
            "kind": "literal",
            "value": "bottom-right"
          }
        },
        {
          "name": "class",
          "optional": true,
          "type": "SlotClassValue",
          "description": "Class applied to the component root or trigger element."
        },
        {
          "name": "classes",
          "optional": true,
          "type": "Classes",
          "description": "Family slot class defaults for this instance."
        },
        {
          "name": "fallback",
          "optional": true,
          "type": "IconT.Name",
          "description": "Icon name to show as fallback."
        },
        {
          "name": "onStatusChange",
          "optional": true,
          "type": "(status: Status) => void",
          "description": "Callback when the loading status of the avatar changes."
        },
        {
          "name": "size",
          "optional": true,
          "type": "'sm' | 'md' | 'lg'",
          "description": "Visual size of the component.",
          "default": {
            "kind": "literal",
            "value": "md"
          }
        },
        {
          "name": "slotName",
          "optional": true,
          "type": "string",
          "description": "Root `data-slot` name, also used as the prefix for child slot names."
        },
        {
          "name": "src",
          "optional": true,
          "type": "string",
          "description": "Source URL for the avatar image."
        },
        {
          "name": "style",
          "optional": true,
          "type": "SlotStyleValue",
          "description": "Style applied to the component root or trigger element."
        },
        {
          "name": "styles",
          "optional": true,
          "type": "Styles",
          "description": "Family slot style defaults for this instance."
        },
        {
          "name": "text",
          "optional": true,
          "type": "string",
          "description": "Initial text to show if image fails or is missing."
        }
      ]
    }
  ],
  "slots": [
    "root",
    "image",
    "fallback",
    "fallbackContent",
    "badge"
  ],
  "dataAttributes": [
    {
      "target": "root",
      "attributes": [
        "data-status"
      ]
    },
    {
      "target": "image",
      "attributes": [
        "data-status"
      ]
    },
    {
      "target": "fallback",
      "attributes": [
        "data-status"
      ]
    }
  ]
}
